{
  "schema": "ar-comms/0",
  "id": "M-01K6Z3V8QX0000000000000006",
  "created": "2026-10-08T21:06:00+00:00",
  "from": "research-agent",
  "iteration": 7,
  "kind": "highlight",
  "title": "v14 promoted",
  "body": "v14 beats v13 62% to 38% over 200 episodes and is now the submitted version.",
  "refs": [
    {
      "uri": "ar://version/v14",
      "rev": "a1b2c3d4e5f60718293a4b5c6d7e8f9012345678",
      "role": "subject"
    },
    {
      "uri": "ar://result/R-0031",
      "rev": "a1b2c3d4e5f60718293a4b5c6d7e8f9012345678",
      "role": "evidence"
    }
  ],
  "priority": "P2",
  "expects_response": false,
  "supersedes": null,
  "expires": null,
  "seq": 6,
  "published_rev": "5f0c6d8e2a9b4c1d7e3f6a8b9c0d1e2f3a4b5c6d"
}
