{
  "schema": "ar-comms/0",
  "id": "M-01K6Z3V8QX0000000000000001",
  "created": "2026-10-08T21:01:00+00:00",
  "from": "runtime",
  "iteration": null,
  "kind": "note",
  "title": "Task ply_f39295d0-ac38-4a62-ac4f-e1d62d7dc9d1:task:tsk_42 done",
  "body": "Card t_3f9a (request Q-01K6Z3V8QX0000000000000009) created for inbound task ply_f39295d0-ac38-4a62-ac4f-e1d62d7dc9d1:task:tsk_42, finished with outcome 'done' and was published at a1b2c3d4e5f60718293a4b5c6d7e8f9012345678.",
  "refs": [],
  "priority": "P2",
  "expects_response": false,
  "supersedes": null,
  "expires": null,
  "in_reply_to": "ply_f39295d0-ac38-4a62-ac4f-e1d62d7dc9d1:task:tsk_42",
  "seq": 1,
  "published_rev": "5f0c6d8e2a9b4c1d7e3f6a8b9c0d1e2f3a4b5c6d"
}
