{
  "schema": "ar-comms/0",
  "id": "M-01K6Z3V8QX0000000000000003",
  "created": "2026-10-08T21:03:00+00:00",
  "from": "research-agent",
  "iteration": 7,
  "kind": "question",
  "title": "Enter the open league now or after v14?",
  "body": "Recommendation: wait for v14. v13 wins 41% in the open league. Options: (A) enter now, (B) wait. Work is not parked.",
  "refs": [],
  "priority": "P1",
  "expects_response": true,
  "supersedes": null,
  "expires": "2026-10-10T00:00:00+00:00",
  "seq": 3,
  "published_rev": "5f0c6d8e2a9b4c1d7e3f6a8b9c0d1e2f3a4b5c6d"
}
